{
  "$schema":"https://json-schema.org/draft/2020-12/schema","$id":"https://cacanode.local/contracts/ai-interview/v1/resume-analysis-outcome-v1.2.schema.json","type":"object","additionalProperties":false,
  "required":["schema_version","event_id","event_type","occurred_at","tenant_id","aggregate_id","analysis_id","application_id","cv_sha256","analysis_mode","policy_version","model_version","analysis_revision","status","summary","evidence","skills","personalized_questions","fit_score_percent","fit_confidence","fit_explanation","strengths","gaps","error_code"],
  "$defs":{"evidence":{"type":"object","additionalProperties":false,"required":["anchor_id","excerpt","source_location"],"properties":{"anchor_id":{"type":"string","minLength":1,"maxLength":80},"excerpt":{"type":"string","minLength":1,"maxLength":500},"source_location":{"type":"string","minLength":1,"maxLength":120}}},"skill":{"type":"object","additionalProperties":false,"required":["name","evidence_anchor_ids"],"properties":{"name":{"type":"string","minLength":1,"maxLength":120},"evidence_anchor_ids":{"type":"array","minItems":1,"maxItems":20,"items":{"type":"string"}}}},"question":{"type":"object","additionalProperties":false,"required":["question_id","target_section_id","prompt","competency","rubric","evidence_anchor_ids"],"properties":{"question_id":{"type":"string","format":"uuid"},"target_section_id":{"type":"string","format":"uuid"},"prompt":{"type":"string","minLength":1,"maxLength":1000},"competency":{"type":"string","minLength":1,"maxLength":200},"rubric":{"type":"string","minLength":1,"maxLength":2000},"evidence_anchor_ids":{"type":"array","minItems":1,"maxItems":20,"items":{"type":"string"}}}},"finding":{"type":"object","additionalProperties":false,"required":["weight_percent","match_percent","evidence_status","explanation","job_excerpt","job_anchor_id","cv_evidence_anchor_ids"],"properties":{"weight_percent":{"type":"integer","minimum":1,"maximum":100},"match_percent":{"type":"integer","minimum":0,"maximum":100},"evidence_status":{"enum":["EVIDENCED","NOT_EVIDENCED"]},"explanation":{"type":"string","minLength":1,"maxLength":1000},"job_excerpt":{"type":"string","minLength":1,"maxLength":2000},"job_anchor_id":{"type":"string","minLength":1,"maxLength":160},"cv_evidence_anchor_ids":{"type":"array","maxItems":20,"items":{"type":"string"}}}}},
  "properties":{"schema_version":{"const":"1.2"},"event_id":{"type":"string","format":"uuid"},"event_type":{"const":"interview.resume-analysis.outcome"},"occurred_at":{"type":"string","format":"date-time"},"tenant_id":{"type":"string","format":"uuid"},"aggregate_id":{"type":"string","format":"uuid"},"analysis_id":{"type":"string","format":"uuid"},"application_id":{"type":"string","format":"uuid"},"cv_sha256":{"type":"string","pattern":"^[a-f0-9]{64}$"},"analysis_mode":{"enum":["SUMMARY_ONLY","PERSONALIZED_QUESTIONS"]},"policy_version":{"type":"string","minLength":1,"maxLength":80},"model_version":{"type":"string","minLength":1,"maxLength":120},"analysis_revision":{"type":"integer","minimum":1},"status":{"enum":["COMPLETED","FAILED"]},"summary":{"type":["string","null"],"maxLength":4000},"evidence":{"type":"array","maxItems":250,"items":{"$ref":"#/$defs/evidence"}},"skills":{"type":"array","maxItems":100,"items":{"$ref":"#/$defs/skill"}},"personalized_questions":{"type":"array","maxItems":2,"items":{"$ref":"#/$defs/question"}},"fit_score_percent":{"type":["integer","null"],"minimum":0,"maximum":100},"fit_confidence":{"enum":["LOW","MEDIUM","HIGH",null]},"fit_explanation":{"type":["string","null"],"maxLength":1000},"strengths":{"type":"array","maxItems":50,"items":{"$ref":"#/$defs/finding"}},"gaps":{"type":"array","maxItems":50,"items":{"$ref":"#/$defs/finding"}},"error_code":{"type":["string","null"],"maxLength":100}}
}
