{
  "schema_version":"1.2","event_id":"cb016982-352e-5e3e-8b17-b9496ecbe84c","event_type":"interview.resume-analysis.outcome","occurred_at":"2026-07-27T08:00:05Z",
  "tenant_id":"11111111-1111-4111-8111-111111111111","aggregate_id":"1a1bb079-8436-5e67-a172-6f8180dbadf5","analysis_id":"1a1bb079-8436-5e67-a172-6f8180dbadf5","application_id":"22222222-2222-4222-8222-222222222222",
  "cv_sha256":"aaaaaaaaaaaaaaaaaaaaaaaaaaaaaaaaaaaaaaaaaaaaaaaaaaaaaaaaaaaaaaaa","analysis_mode":"PERSONALIZED_QUESTIONS","policy_version":"cv-redaction-fit-v2","model_version":"resume-analysis-v2","analysis_revision":2,"status":"COMPLETED",
  "summary":"Backend engineer with evidence of Java service delivery.","evidence":[{"anchor_id":"a-1","excerpt":"Built Java services","source_location":"page 1"},{"anchor_id":"a-2","excerpt":"Supported production systems","source_location":"page 2"}],
  "skills":[{"name":"Java","evidence_anchor_ids":["a-1"]}],"personalized_questions":[],"fit_score_percent":55,"fit_confidence":"MEDIUM","fit_explanation":"Advisory fit is supported by direct Java evidence, while production ownership is only partially evidenced and the requested experience level is not evidenced in the CV.",
  "strengths":[{"weight_percent":50,"match_percent":90,"evidence_status":"EVIDENCED","explanation":"The CV directly evidences Java service development.","job_excerpt":"Build reliable Java services.","job_anchor_id":"job:description","cv_evidence_anchor_ids":["a-1"]}],
  "gaps":[{"weight_percent":25,"match_percent":40,"evidence_status":"EVIDENCED","explanation":"Production support is evidenced, but reliability ownership is only partial.","job_excerpt":"Build reliable Java services.","job_anchor_id":"job:description","cv_evidence_anchor_ids":["a-2"]},{"weight_percent":25,"match_percent":0,"evidence_status":"NOT_EVIDENCED","explanation":"The MID experience level is not evidenced in the CV; this is not proof that the candidate lacks it.","job_excerpt":"MID","job_anchor_id":"job:experience_level","cv_evidence_anchor_ids":[]}],"error_code":null
}
